lov_id	sprak	created_at	updated_at	tittel	kort_tittel	oversetter	bibsys	url	note	inote	utgave
509	ENG	16-AUG-02	15-JAN-09	Regulations relating to the return of stolen unlawfully removed cultural objects		Ministry of Cultural and Church Affairs		for-20011004-1179-eng.pdf			Amended as of May 14th 2002
510	ENG	30-APR-02	20-NOV-03	Regulations relating to nonylphenol and octylphenol and their ethoxylates		Ministry of the Environment		http://odin.dep.no/md/engelsk/regelverk/lover/022051-200007/index-dok000-b-n-a.html			
511	ENG	06-JUL-09	06-JUL-09	Regulation concerning the medical examination of employees on ships				for-20011019-1309-eng.pdf			Amended 29 June 2007
512	ENG	06-JUL-09	06-JUL-09	Regulation concerning water supply and water intended for human consumption	Drinking water regulations			for-20011204-1372-eng.pdf	Excerpts from the regulation		Amended 6 July 2007
513	ENG	18-NOV-13	18-NOV-13	Regulations relating to maritime installations		Norwegian Directorate for Civil Protection		http://www.dsb.no/Global/Publikasjoner/2013/Andre/regulations_relating_to_maritime_electrical_installations.pdf			
514	ENG	16-AUG-02	15-MAR-11	Regulations relating to a prohibition against the export of cultural objects		Ministry of Cultural and Church Affairs		http://www.regjeringen.no/upload/KKD/Kultur/Regulations%20relating%20to%20a%20prohibition%20against%20the%20export%20of%20cultural%20objects.pdf			
515	ENG	03-OCT-03	20-MAY-14	Regulations on the collection and processing of personal health data in the Cancer Registry of Norway	Cancer Registry Regulations	Ministry of Health and Social Affairs		for-20011221-1477-eng.pdf			
516	ENG	29-JUL-02	29-MAY-12	Regulations relating to fishing by vessels flying the Greenland flag in the economic zone of Norway in 2002				for-20020221-0254-eng.pdf			With amendments of 31st May 2002
517	ENG	06-JAN-16	08-JAN-21	Regulations relating to the Execution of Sentences	Regulations relating to the Execution of Sentences			http://www.kriminalomsorgen.no/getfile.php/4187062.823.qzaqtkststjnqa/Regulations+relating+to+the+Execution+of+Sentences+-+translated+June+2018.pdf			
518	ENG	01-JUL-09	01-JUL-09	Regulation concerning welding, welding equipment, hot work and storage of gas cylinders on board ships				for-20020425-0422-eng.pdf			Amended 29 June 2007
519	ENG	06-JUL-09	06-JUL-09	Regulation concerning weork by and placement of young people on Norwegian ships				for-20020425-0423-eng.pdf			Amended as of 29th June 2007
520	ENG	06-JUL-09	06-JUL-09	Regulation concerning treatment of disputes on Norwegian ships				for-20020425-0424-eng.pdf			Amended 8 November 2007
521	ENG	06-JUL-09	06-JUL-09	Regulation concerning cargo ships with natural gas fuelled internal combustion engines				for-20020617-0644-eng.pdf			Amended 29 June 2007
522	ENG	13-JAN-16	13-JAN-16	Regulations relating to persistent, bioaccumulative and toxic substances, waste and waste water and waste management fees in Svalbard		Ministry of Climate and Environment		https://www.regjeringen.no/en/dokumenter/substances-waste-svalbard/id512067/			
523	RUS	06-DEC-16	06-DEC-16	&#1055;&#1088;&#1077;&#1076;&#1087;&#1080;&#1089;&#1072;&#1085;&#1080;&#1077; &#1086; &#1088;&#1072;&#1079;&#1073;&#1080;&#1074;&#1082;&#1077; &#1083;&#1072;&#1075;&#1077;&#1088;&#1077;&#1081; &#1080; &#1087;&#1088;&#1077;&#1073;&#1099;&#1074;&#1072;&#1085;&#1080;&#1080; &#1074; &#1085;&#1080;&#1093; &#1085;&#1072; &#1057;&#1074;&#1072;&#1083;&#1100;&#1073;&#1072;&#1088;&#1076;&#1077;				https://www.regjeringen.no/en/dokumenter/----------2/id440511/			
523	ENG	13-JAN-16	13-JAN-16	Regulations relating to camping activities in Svalbard		Ministry of Climate and Environment		https://www.regjeringen.no/en/dokumenter/camping-svalbard/id512068/			
524	ENG	05-FEB-09	05-FEB-09	Regulation concerning ship's name, call sign and home port, etc.				for-20020627-0754-eng.pdf			
525	ENG	14-JAN-16	14-JAN-16	Regulations relating to environmental impact assessment and delimitation of the land-use planning areas in Svalbard		Ministry of Climate and Environment		https://www.regjeringen.no/en/dokumenter/regulations-relating-to-environmental-im/id512069/			
526	ENG	13-JAN-16	13-JAN-16	Regulations relating to a requirement to keep dogs on a leash in Svalbard		Ministry of Climate and Environment		https://www.regjeringen.no/en/dokumenter/regulations-relating-to-a-requirement-to/id512070/			
527	ENG	04-SEP-09	04-SEP-09	Regulations on markerting of securities funds				http://www.kredittilsynet.no/Global/English/Laws_and_regulations/Securities_market/Marketing_Securities_Funds_Regulations.pdf			
528	ENG	01-JUL-09	01-JUL-09	Regulation concerning conditions for periodical maintenance of float-free emergency position-indicating radio beacons				for-20021112-1314-eng.pdf			Amended 29 June 2007
529	ENG	30-MAY-03	29-MAY-12	Regulations relating to substances that deplete the ozone layer		Ministry of Environmental Affairs		for-20021220-1818-eng.pdf			
530	ENG	08-OCT-03	08-OCT-03	Regulations relating to restrictions on the use, etc. of certain dangerous chemicals		Norwegian Pollution Control Authority		for-20021220-1823-eng.pdf			
531	ENG	14-JAN-16	14-JAN-16	Regulations on the Allocation of Railway Infrastructure Capacity and the Levying of Charges for the Use of the National Railway Network	Allocation Regulations	Ministry of Transport and Communications		https://www.regjeringen.no/en/dokumenter/Regulations-on-the-Allocation-of-Railway/id469905/			
532	ENG	06-JUL-09	06-JUL-09	Regulation on the accelerated phasing-in of double hull or equivalent design requirements for single-hull oil tankers				for-20030220-0254-eng.pdf			Amended 29 June 2007
533	ENG	27-OCT-04	28-NOV-16	Design Regulations				https://www.patentstyret.no/en/norwegian-design-regulations			
534	ENG	06-JUL-09	06-JUL-09	Regulation concerning qualification requirements and certificate rights for personnel on board Norwegian ships, fishing vessels and moble offshore units				for-20030509-0687-eng.pdf			Amended 18 October 2007
535	ENG	14-JUN-05	23-FEB-18	Regulations on use of information and communication technology (ICT)				https://www.finanstilsynet.no/globalassets/laws-and-regulations/regulations/regulations-on-use-of-ict.pdf			
536	ENG	03-FEB-09	03-FEB-09	Regulation concerning the control of foreign ships and mobile offshore units in Norwegian ports, etc.				for-20030701-0969-eng.pdf			
537	ENG	04-FEB-11	04-FEB-11	Regulation on domain names under Norwegian country code toplevel domains	The Domain regulation			http://www.npt.no/pt_internet/eng/regulations/regulations/Regulation_on_domain_names.pdf			
538	ENG	06-JUL-09	06-JUL-09	Regulation concerning the safe loading and unloading of bulk carriers				for-20030829-1114-eng.pdf			Amended 29 June 2007
539	ENG	06-FEB-09	06-FEB-09	Regulation concerning the prohibition of organotin compounds on ships				for-20031120-1388-eng.pdf			
540	ENG	14-JUN-05	14-JUN-05	Regulations on measurements to combat the laundering of proceeds of crime etc.	Money Laundering Regulations	Kredittilsynet		for-20031210-1487-eng.pdf			Translation date: July 2004
541	ENG	27-MAY-05	27-MAY-05	Regulations relating to fees for services		The Brønnøysund Register Centre		http://www.brreg.no/english/acts/gebyrforskrift.html			
542	ENG	04-SEP-09	04-SEP-09	Regulations on nominee registration in securities funds' unit holder registers				http://www.kredittilsynet.no/Global/English/Laws_and_regulations/Securities_market/Regulations_nominee_registration_securities_funds.pdf			
543	ENG	03-SEP-09	15-SEP-14	Regulations on supervision of holdings in financial institutions				http://www.kredittilsynet.no/Global/English/Laws_and_regulations/Regulations/Regulations_supervision_holdings_financial_institutions.pdf			Translation published: April 2008
544	ENG	15-JAN-09	15-JAN-09	Temporary regulations relating to safety and working environment for certain petroleum facilities on land and associated pipeline systems				for-20031219-1595-eng.pdf			
545	ENG	10-FEB-09	10-FEB-09	Regulation concerning fees payable for services provided by the Norwegian Maritime Directorate	The Tariff of Fees			for-20040113-0252-eng.pdf			
546	ENG	04-FEB-11	04-FEB-11	Regulations on electronic communications networks and services	Ecom regulations			http://www.npt.no/ikbViewer/Content/ekomforskrift_eng.pdf?documentID=30917			
547	ENG	04-FEB-11	04-FEB-11	Regulations on numbering resources for electronic communications networks and services	Numbering regulations			http://www.npt.no/pt_internet/eng/regulations/regulations/nummerforskriften_eng.pdf			
548	ENG	18-APR-07	15-SEP-14	Regulations relating to the transfer of biobank material to other countries		Ministry of Health and Care Services		for-20040226-0511-eng.pdf			Translation date: April 2007
549	ENG	14-JAN-16	14-JAN-16	Regulations relating to restrictions on the manufacture, import, export, sale and use of chemicals and other products hazardous to health and the environment	Product Regulations	Ministry of Climate and Environment		https://www.regjeringen.no/en/dokumenter/product-regulations/id512072/			
550	ENG	14-JAN-16	14-JAN-16	Regulations relating to the recycling of waste	Waste Regulations	Ministry of Climate and Environment		https://www.regjeringen.no/en/dokumenter/waste-regulations/id512073/			
551	ENG	06-FEB-09	15-SEP-14	Regulations relating to pollution control	Pollution regulations			http://www.miljodirektoratet.no/no/Regelverk/Forskrifter/Regulations-relating-to-pollution-control-Pollution-Regulations/			Last updated: March 2012
552	ENG	01-JUL-09	01-JUL-09	Regulation concerning protective security measures on board ships and mobile offshore drilling units				for-20040622-0972-eng.pdf			Amended 29 June 2007
553	ENG	02-JUL-09	02-JUL-09	Regulation concerning life-saving appliances on passenger ships				for-20041011-1341-eng.pdf			Amended 29 June 2007
554	ENG	14-DEC-07	07-JAN-16	The bookkeeping regulation		Norwegian Institute of Public Accountants		http://bibsys-primo.hosted.exlibrisgroup.com/UBO:default_scope:BIBSYS_ILS71471456300002201	The Norwegian Institute of Public Accountants may provide an electronic version		
555	ENG	02-JUL-09	02-JUL-09	Regulation concerning life-saving appliances on cargo ships				for-20041217-1855-eng.pdf			Amended 29 June 2007
556	ENG	06-JUL-09	06-JUL-09	Regulation concerning radiocommunication for cargo ships				for-20041217-1856-eng.pdf			Amended 29 June 2007
557	ENG	06-JUL-09	06-JUL-09	Regulation concerning the working environment, health and safety of workers on board ship				for-20050101-0008-eng.pdf			Amended 29 June 2007
558	ENG	06-JUL-09	06-JUL-09	Regulation concerning guarantees for social security entitlements for employees on Norwegian ships				for-20050218-0145-eng.pdf			
559	ENG	06-JUL-09	06-JUL-09	Regulation concerning guarantee of remuneration for work and of passage home for employees on ships registered in the Norwegian International Ship Register				for-20050218-0146-eng.pdf			
560	ENG	04-FEB-11	04-FEB-11	Regulations relating to administrative charges payable to the Norwegian Post and Telecommunications Authority				http://www.npt.no/ikbViewer/Content/44366/Gebyrforskrift%20gjeldende%20fra%201_1_2009.pdf			
561	ENG	06-JUL-09	06-JUL-09	Regulation concerning the obligations of the master and company in the event that a criminal offence of a serious nature is committed on board ship, and concerning notification of missing persons				for-20050301-0235-eng.pdf			Amended 29 June 2007
562	ENG	04-FEB-11	04-FEB-11	Regulations on authorization of electronic communications networks and radio equipment installation contractors				http://www.npt.no/ikbViewer/Content/Authorization.pdf?documentID=49799			
563	ENG	02-JUL-07	15-SEP-14	Regulations ont he sale of alcoholic beverages	Alcohol Regulations			for-20050608-0538-eng.pdf			Unofficial translation - June 2007
564	ENG	15-FEB-06	16-MAY-12	Regulations relating to the labelling, transport, import and export of genetically modified organisms		Ministry of Environment		http://www.regjeringen.no/en/dep/md/documents-and-publications/acts-and-regulations/regulations/2005/regulations-relating-to-the-labelling-tr.html?id=440383			
565	ENG	02-JUL-09	02-JUL-09	Regulation concerning the construction and operation of gas-fuelled passanger ships				for-20050909-1218-eng.pdf			Amended 29 June 2007
566	ENG	04-FEB-11	04-FEB-11	Regulations on safety in electronic communications network				http://www.npt.no/ikbViewer/Content/100829/safety_ecom.pdf			
567	ENG	14-MAR-13	19-SEP-14	Regulations concerning requirements for master's degrees		Ministry of Education		http://www.regjeringen.no/upload/KD/Vedlegg/UH/forskrifter/Regulations_Requirements_MasterDegree.pdf			
568	ENG	11-MAY-06	11-MAY-06	Regulations on insurance mediation		The Financial Supervision Authority of Norway		for-20051209-1421-eng.pdf			
569	ENG	04-SEP-06	16-MAY-12	Regulations relating to impact assessment pursuant to the Gene Technology Act		Ministry of the Environment		http://www.regjeringen.no/en/dep/md/documents-and-publications/acts-and-regulations/regulations/2005/regulations-relating-to-impact-assessmen.html?id=440455			
570	ENG	09-MAY-08	09-MAY-08	Regulations regarding the organisation and activities of the Equality and anti-discrimination ombud and the Equality and anti-discrimination tribunal		Ministry of Children and Equality		http://www.regjeringen.no/en/dep/bld/Documents/Laws-and-rules/Regulations/2006/Regulations-regarding-the-organisation-a-2.html?id=92611			
571	ENG	28-DEC-10	28-DEC-10	Regulations concerning posted workers		Ministry of Labour		http://www.regjeringen.no/en/dep/aid/doc/lover_regler/forskrifter/2005/regulations-of-16-december-2005-no-1566-.html?id=540201			
572	ENG	20-JAN-16	20-JAN-16	Regulations concerning terms and conditions of employment for post-doctoral research fellow, research fellow and research assistant		Ministry of Education and Research		https://www.regjeringen.no/en/dokumenter/Regulations-concerning-terms-and-conditions-of-employment-for-post-doctoral-research-fellow-research-fellow-and-research-assistant/id92637/			
573	ENG	14-JAN-16	14-JAN-16	Regulations concerning appointment and promotion to teaching and research posts		Ministry of Education and Research		https://www.regjeringen.no/en/dokumenter/regulations-concerning-appointment-and-p/id270830/			
574	ENG	30-APR-07	30-APR-07	Regulations on certain aspects relating to the political parties	Political Parties Act Regulations	Ministry of Government Administration and Reform		for-20060316-0321-eng.pdf			
575	ENG	14-JAN-16	14-JAN-16	Regulations on Public Investigations of Railway Accidents and Serious Railway Incidents etc.	Railway Investigation Regulations	Ministry of Transport and Communications		https://www.regjeringen.no/en/dokumenter/Regulations-on-Public-Investigations-of-/id469897/			
576	ENG	14-JAN-16	14-JAN-16	Regulations on the Obligation to Notify and Report Railway Accidents and Railway Incidents	Notification and Reporting Regulations	Ministry of Transport and Communications		https://www.regjeringen.no/en/dokumenter/Regulations-on-the-Obligation-to-Notify-/id469901/			
577	ENG	18-NOV-13	18-NOV-13	Safety regulations related to the maintenance and operation of electrical installations		Norwegian Directorate for Civil Protection		http://www.dsb.no/Global/Publikasjoner/2013/Andre/safety_regulations_related_to_the_maintenance_and_operation_of_electrical_installations.pdf			
578	ENG	06-JUL-09	06-JUL-09	Regulation concerning the carriage of cargoes on cargo ships and barges				for-20060629-0785-eng.pdf			Amended 29 June 2007
579	ENG	02-JUL-09	02-JUL-09	Regulation concerning the carriage of dangerous cargoes on cargo ships and barges				for-20060629-0786-eng.pdf			Amended 29 June 2007
580	ENG	14-JAN-16	14-JAN-16	Regulations relating to suitability assessment in higher education		Ministry of Education and Research		https://www.regjeringen.no/en/dokumenter/regulations-relating-to-suitability-asse/id640019/			
581	ENG	14-JAN-16	14-JAN-16	Regulations on Compulsory Abstinence from Alcohol etc., for Personnel performing Tasks related to Safety on Railways, including Tramways, Underground Railways and Suburban Railways etc.	Abstinence Regulations	Ministry of Transport and Communications		https://www.regjeringen.no/en/dokumenter/Regulations-on-Compulsory-Abstinence-fro/id469904/			
582	ENG	13-JAN-16	13-JAN-16	Regulation relating to an environment fee for visitors to Svalbard		Ministry of Climate and Environment		https://www.regjeringen.no/en/dokumenter/environment-fee/id512077/			
583	ENG	04-JAN-08	04-JAN-08	Regulation concerning trial programme of legal mediation for land consolidation courts				for-20070122-0080-eng.pdf			
584	ENG	14-DEC-12	14-DEC-12	Regulations concerning admission to higher education		Ministry of Education and Research		http://www.regjeringen.no/upload/KD/Vedlegg/UH/forskrifter/Regulations_Admission_HigherEducation.pdf			With amendments of 2009-01-31- no. 1393
585	ENG	13-JAN-16	13-JAN-16	Regulations relating to grants from the Svalbard Environmental Protection Fund		Ministry of Climate and Environment		https://www.regjeringen.no/en/dokumenter/grants-svalbard-envrionment-fund/id750407/			
586	ENG	06-JUL-09	06-JUL-09	Regulation concerning hours of work and rest on board Norwegian passenger and cargo ships, etc.				for-20070626-0705-eng.pdf			
587	ENG	04-SEP-09	30-JUN-15	Regulation on regulated markets	Stock Exchange Regulations			http://www.oslobors.no/ob_eng/obnewsletter/download/8cad89af833b6fa6d248246dae615c73/file/file/The_Stock_Exchange_Regulations.pdf			Translation updated August 2008
588	ENG	04-SEP-09	30-JUN-15	Regulations to the Securities Trading Act	Securities Trading Regulations			http://www.finanstilsynet.no/Global/English/Laws_and_regulations/Securities_market/Regulations_Securities_Trading_Act.pdf			Translation update: December 2013
589	ENG	03-FEB-09	03-FEB-09	Regulation concerning investigation, stopping and boarding of foreign ships in the event of suspicion of an environmental violation				for-20070702-0850-eng.pdf			
590	ENG	10-FEB-09	10-FEB-09	Regulation concerning the determination and implementation of violation fines pursuant to the Act of 16 February 2007 no. 9 relating to Ship Safety and Security (the Ship Safety and Security Act) sections 55 and 56				for-20070702-0852-eng.pdf			
591	ENG	04-JUN-13	04-JUN-13	Regulation governing continental shelf operations - commercial air traffic to and from helidecks on offshore installations and vessels				http://www.lovdata.no/for/sf/sd/td-20071026-1181-017.html			With amendments issued 28th January 2008
592	ENG	10-FEB-09	10-FEB-09	Regulation concerning fees for the issue of certificates and endorsements to maritime personnel				for-20071123-1319-eng.pdf			
593	ENG	20-JUL-10	07-JAN-16	Regulation relating to exemptions from the Limited Liability Act section 8-10 and the Public Limited Liability Companies Act section 8-10				http://bibsys-primo.hosted.exlibrisgroup.com/UBO:default_scope:BIBSYS_ILS71484557440002201	Den norske revisorforening (The Norwegian Institute of Public Accountants) may provide an electronic version		Updated as per July 2013
594	ENG	30-SEP-10	28-NOV-16	Regulations to the Norwegian Patents Act	The Patent Regulations			https://www.patentstyret.no/en/norwegian-patent-regulations			
595	ENG	23-FEB-18	23-FEB-18	Regulations on Risk Management and Internal Control				https://www.finanstilsynet.no/globalassets/laws-and-regulations/regulations/regulations-on-risk-management-and-internal-control.pdf			
596	ENG	03-SEP-09	03-SEP-09	Regulation on public administration of branches of banks with their head offices in foreign countries				http://www.kredittilsynet.no/Global/English/Laws_and_regulations/Banking_finance/Regulation_Public_Administration_Branches_Banks.pdf			
597	ENG	05-DEC-13	05-DEC-13	Regulations to Act on customs duties and movement of goods	Customs Regulations	Directorate of Customs and Excise		http://www.toll.no/upload/Lov_Forskrift/Regulations_to_the_Act_on_Customs_Duties_and_Movement_of_Goods_Curstoms_Regulations.pdf			With current amendments
598	ENG	22-DEC-14	22-DEC-14	Regulations on tuberculosis control		Ministry of Health and Care Services		for-20090213-0205-eng.pdf	Translation of December 2014		Last amended by For-2014-05-23-667
599	ENG	03-SEP-09	09-JAN-21	Regulations concerning measures to combat money laundering and the financing of terrorism, etc.				https://www.finanstilsynet.no/globalassets/laws-and-regulations/regulations/money-laundering-regulations-2009.pdf			Translation as of April 2009
600	ENG	03-SEP-09	09-JAN-21	Regulations concerning the Supervisory Board for Measures to Combat the Laundering of the Proceeds of Crime				https://www.finanstilsynet.no/globalassets/laws-and-regulations/regulations/supervisory-board-regulations-money-laundering-2009.pdf			Translation as of April 2009
601	ENG	13-JAN-16	13-JAN-16	Regulations relating to the Norwegian State Finance Fund.		Ministry of Finance		https://www.regjeringen.no/en/dokumenter/regulations-relating-to-the-norwegian-st/id560619/			
602	ENG	04-FEB-11	04-FEB-11	Regulations concerning general authorisations for the use of radio frequencies				http://www.npt.no/ikbViewer/Content/103810/Regulations_concerning_general_authorisations_for_the_use_of_radio_frequencies.pdf			
603	ENG	11-FEB-10	11-FEB-10	Regulations regarding reporting and reconciliation of cash flow from petroleum activities		Ministry of Petroleum and Energy		for-20090626-0856-eng.pdf			
604	ENG	18-APR-18	18-APR-18	Construction Client Regulations	Construction Client Regulations			https://lovdata.no/dokument/SFE/forskrift/2009-08-03-1028			
605	ENG	01-SEP-10	01-SEP-10	Regulations on support for audiovisual productions				for-20090907-1168-eng.pdf			With amendments of 16 April 2010 no. 526
606	ENG	07-JUL-11	15-SEP-14	Regulations on the entry of foreign nationals into the Kingdom of Norway and their stay in the realm	Immigration regulations	Ministry of Justice		http://www.regjeringen.no/upload/JD/Vedlegg/Forskrifter/Immigration_Regulation.pdf			Translation: November 2010
607	ENG	28-MAY-10	15-SEP-14	Regulations issued pursuant to the Minerals Act		Ministry of Trade and Industry		for-20091223-1842-eng.pdf			Translation as of 17th February 2011
608	ENG	20-JAN-16	20-JAN-16	National Curriculum Regulations for Differentiated Primary and Lower Secondary Teacher Education Programmes for Years 1  7 and Years 5  10		Ministry of Education and Research		https://www.regjeringen.no/en/dokumenter/national-curriculum-regulations-for-diff/id594357/			
609	ENG	30-SEP-10	28-NOV-16	Trademark Regulations				https://www.patentstyret.no/en/norwegian-trademark-regulations			
610	ENG	21-FEB-11	15-SEP-14	Regulations concerning maps of underground and opencast mining facilities		Ministry of Trade and Industry		for-20101220-1784-eng.pdf			Translation as of 17th February 2011
611	ENG	28-JUN-18	28-JUN-18	Regulations concerning Organisation, Management and Employee Participation	Regulations concerning Organisation, Management and Employee Participation			https://lovdata.no/dokument/SFE/forskrift/2011-12-06-1355			
612	ENG	28-JUN-18	28-JUN-18	Regulations concerning the design and layout of workplaces and work premises	The Workplace Regulations			https://lovdata.no/dokument/SFE/forskrift/2011-12-06-1356			
613	ENG	28-JUN-18	28-JUN-18	Regulations concerning the performance of work, use of work equipment and related technical requirements	Regulations concerning the Performance of Work			https://lovdata.no/dokument/SFE/forskrift/2011-12-06-1357			
614	ENG	28-JUN-18	28-JUN-18	Regulations concerning the construction, design and production of work equipment and chemicals	The Producer Responsibility Regulations			https://lovdata.no/dokument/SFE/forskrift/2011-12-06-1359			
615	ENG	28-JUN-18	28-JUN-18	Regulations concerning administrative arrangements within the area of application of the Working Environment Act	Regulations concerning Administrative Arrangements			https://lovdata.no/dokument/SFE/forskrift/2011-12-06-1360			
616	ENG	07-FEB-14	07-FEB-14	Regulations relating to elcertificates		Statsnett		http://www.statnett.no/Global/Dokumenter/Kraftsystemet/Elsertifikater/English%20unofficial%20translation%20of%20Norwegian%20regulation%20elcertificates.pdf			
618	SPA	10-JUL-13	19-MAY-14	Reglamento sobre la Tarifa de tasas aplicables por las Misiones del Servicio Exterior de Noruega				for-20130125-0058-spa.pdf			As amended of 20th December 2013 no 1667
618	ENG	10-JUL-13	16-JAN-14	Regulations relating to the table of fees for Norwegian diplomatic and consular missions laid down by Royal Decree				for-20130125-0058-eng.pdf			As amended of 20th December 2013 no 1667
619	ENG	13-JAN-16	13-JAN-16	Regulation for universal design of information and communication technology (ICT) solutions		Ministry of Local Government and Modernisation		https://www.regjeringen.no/en/dokumenter/regulation-universal-design-ict/id731520/			
620	ENG	13-JAN-16	13-JAN-16	Regulations relating to large nature conservation areas and bird reserves in Svalbard as established in 1973		Ministry of Climate and Environment		https://www.regjeringen.no/en/dokumenter/regulation-nature-consrevation-areas-bird-reserves-svalbard/id2355095/			
621	SPA	23-JUL-14	23-JUL-14	Reglamento sobre las tasas aplicables por las misiones del servicio exterior de Noruega		Ministry of Foreign Affairs		for-20140620-0780-spa.pdf			
621	FRE	23-JUL-14	23-JUL-14	Règlement relatif aux droits applicables par les missions diplomatiques et consulaires		Ministry of Foreign Affairs		for-20140620-0780-fre.pdf			
621	ENG	23-JUL-14	23-JUL-14	Regulations relating to fees payable at Norway's diplomatic and consular missions		Ministry of Foreign Affairs		for-20140620-0780-eng.pdf			
622	ENG	13-JAN-16	13-JAN-16	Regulations of 30 January 2015 No. 72 on Intercountry Adoption		Ministry of Children, Equality and Social Inclusion		https://www.regjeringen.no/en/dokumenter/forskrift-om-adopsjon-av-barn-fra-utlandet/id2424690/			
